{
  "palette": {
    "surface1": "#0d0e12",
    "surface2": "#14151a",
    "surface3": "#1c1e26",
    "textPrimary": "#f2f4f8",
    "textMuted": "#8a8f9e",
    "textInverse": "#0d0e12",
    "accent": "#ff6a00",
    "accentStrong": "#ff5100",
    "border": "#232530",
    "focusRing": "#ff6a00",
    "success": "#22c55e",
    "warning": "#f59e0b",
    "danger": "#f43f5e",
    "info": "#38bdf8",
    "codeBg": "#121318",
    "codeMuted": "#8a8f9e",
    "codeHoverBg": "#1e2029",
    "codeHoverText": "#f2f4f8",
    "heading7": "#cbd5e1",
    "popoverBg": "#16171d",
    "popoverBorder": "#2b2d39",
    "popoverText": "#f2f4f8",
    "popoverMuted": "#8a8f9e",
    "popoverActiveBg": "#242632",
    "popoverActiveText": "#ffffff",
    "taskAccent": "#ff6a00",
    "codeKeyword": "#ff7315",
    "codeString": "#98c379",
    "codeNumber": "#fb923c",
    "codeComment": "#5c6370",
    "codeFunction": "#f97316",
    "codeType": "#e5c07b",
    "codeVariable": "#e06c75",
    "codeOperator": "#abb2bf"
  },
  "radius": {
    "sm": "4px",
    "md": "8px",
    "lg": "12px",
    "pill": "999px"
  },
  "spacing": {
    "xs": "4px",
    "sm": "8px",
    "md": "12px",
    "lg": "16px",
    "xl": "24px"
  },
  "shadow": {
    "sm": "0 1px 2px rgba(0, 0, 0, 0.25)",
    "md": "0 4px 12px rgba(0, 0, 0, 0.25)",
    "lg": "0 10px 30px rgba(0, 0, 0, 0.3)"
  },
  "font": {
    "sans": "Inter, ui-sans-serif, system-ui, -apple-system, BlinkMacSystemFont, 'Segoe UI', sans-serif",
    "mono": "JetBrains Mono, ui-monospace, SFMono-Regular, Menlo, Monaco, Consolas, 'Liberation Mono', 'Courier New', monospace"
  }
}
