{
  "palette": {
    "surface1": "#0f172a",
    "surface2": "#111827",
    "surface3": "#0b1220",
    "textPrimary": "#e2e8f0",
    "textMuted": "#94a3b8",
    "textInverse": "#0b1220",
    "accent": "#a78bfa",
    "accentStrong": "#8b5cf6",
    "border": "#1f2937",
    "focusRing": "#7c3aed",
    "success": "#22c55e",
    "warning": "#f59e0b",
    "danger": "#f43f5e",
    "info": "#38bdf8",
    "codeBg": "#0b1220",
    "codeMuted": "#94a3b8",
    "codeHoverBg": "#1e293b",
    "codeHoverText": "#e2e8f0",
    "heading7": "#cbd5e1",
    "popoverBg": "#1e1e24",
    "popoverBorder": "#333338",
    "popoverText": "#e2e8f0",
    "popoverMuted": "#94a3b8",
    "popoverActiveBg": "#2d2d35",
    "popoverActiveText": "#ffffff",
    "taskAccent": "#22c55e"
  },
  "radius": {
    "sm": "4px",
    "md": "8px",
    "lg": "12px",
    "pill": "999px"
  },
  "spacing": {
    "xs": "4px",
    "sm": "8px",
    "md": "12px",
    "lg": "16px",
    "xl": "24px"
  },
  "shadow": {
    "sm": "0 1px 2px rgba(0, 0, 0, 0.25)",
    "md": "0 4px 12px rgba(0, 0, 0, 0.25)",
    "lg": "0 10px 30px rgba(0, 0, 0, 0.3)"
  },
  "font": {
    "sans": "Inter, ui-sans-serif, system-ui, -apple-system, BlinkMacSystemFont, 'Segoe UI', sans-serif",
    "mono": "JetBrains Mono, ui-monospace, SFMono-Regular, Menlo, Monaco, Consolas, 'Liberation Mono', 'Courier New', monospace"
  }
}
